<?xml version = '1.0' encoding = 'ISO-8859-1' ?>
<!DOCTYPE schema SYSTEM '../../../ZConfig/doc/schema.dtd' >

<schema
    datatype=".app.VersionConfig.fromZConfig"
    prefix="peak.tools.version"
>

<import package="peak.tools.version"/>

<key name="DataFile" attribute="datafile" datatype="existing-file">
    <description>
    </description>
</key>

<multisection name="*" type="Scheme" attribute="schemes" required="yes">
    <description>
    </description>
</multisection>

<multisection name="*" type="Module" attribute="modules" required="yes">
    <description>
    </description>
</multisection>

</schema>
